Organization,Organization Description,Organization Status,Country,Region,City,Organization Employee Count,Organization Website,Organization Name,Founders,Investors
Honeycomb,Honeycomb is a real estate insurance company that provides coverage for landlord Insurance and condo association insurance.,active,United States,Illinois,Chicago,101-250,https://honeycombinsurance.com,Honeycomb,,
Obsidian Entertainment,Obsidian Entertainment is an American role-playing video game.,active,United States,California,Irvine,251-500,http://www.obsidian.net/,Obsidian Entertainment,,
Coast,Coast is a financial services platform that provides fleet fuel cards and expense management solutions for various industries.,active,United States,New York,New York,101-250,https://coastpay.com,Coast,,
MIAX Exchange Group,"MIAX Exchange Group is a trading company that operates electronic exchanges covering equity options, equities, and international securities.",active,United States,New Jersey,Princeton,101-250,https://www.miaxglobal.com/,MIAX Exchange Group,,
Ellevest,Ellevest provides an engaging investing experience to help women meet their financial goals in life.,active,United States,New York,New York,101-250,https://www.ellevest.com,Ellevest,,
Teamshares,Teamshares is an employee ownership platform for small business.,active,United States,New York,Brooklyn,101-250,https://www.teamshares.com,Teamshares,,
Amount,Amount is a digital technology company that accelerates digital transformation for financial institutions.,active,United States,Illinois,Chicago,101-250,http://www.amount.com,Amount,,
LIQUiDITY Group,"Liquidity Group deploys capital at scale faster using advanced decision science, due diligence, monitoring, and predictive technology.",active,United States,New York,New York,101-250,https://www.liquiditygroup.com,LIQUiDITY Group,,
Lumber,"Lumber is an automated payroll, time-tracking, accounts payable, compliance, and onboarding platform for the construction industry.",active,United States,California,San Jose,101-250,https://www.lumberfi.com/,Lumber,,
Orum.io,"One solution to access RTP, FedNow, Same Day ACH, ACH, Wires — and now instant bank account verification.",active,United States,New York,New York,51-100,https://orum.io,Orum.io,,
Extend,"Extend is the only digital card platform compatible with every commercial card, designed to modernize the way payments are made and managed.",active,United States,New York,New York,51-100,https://paywithextend.com/,Extend,,
Truework,"Truework is a one-stop platform that helps banks, lenders, and others verify income and employment.",active,United States,California,San Francisco,101-250,https://www.truework.com,Truework,,
Sepio,"Sepio provides asset risk management services for the financial, insurance, healthcare, and manufacturing industries.",active,United States,Maryland,Rockville,51-100,https://sepiocyber.com,Sepio,,
Francisco Partners,Francisco Partners is a global investment firm that specializes in partnering with technology and technology-enabled businesses.,active,United States,California,San Francisco,101-250,https://www.franciscopartners.com,Francisco Partners,,
Ultipa,"Ultipa is a real-time graph XAI & database company, and empowers smart enterprises with graph augmented intelligence.",active,United States,California,San Ramon,51-100,https://www.ultipa.com,Ultipa,,
Moment,Moment is an operator of a fixed-income infrastructure for modern firms.,active,United States,New York,New York,51-100,https://www.withmoment.com/,Moment,,
MainStreet,MainStreet is a financial platform that helps startups and small businesses discover and claim tax credits and government incentives.,active,United States,California,San Jose,51-100,https://www.mainstreet.com,MainStreet,,
Polly,"Polly is a revolutionary, end-to-end capital markets ecosystem that lenders trust to optimize performance and maximize profitability.",active,United States,California,San Francisco,101-250,https://www.polly.io,Polly,,
Limble CMMS,Limble CMMS is an asset management and CMMS platform that provides maintenance management solutions to businesses.,active,United States,Utah,Lehi,251-500,https://limblecmms.com,Limble CMMS,,
Windfall,Windfall is a people intelligence platform that provides AI workflow solutions to identify their audiences through automation.,active,United States,California,San Francisco,51-100,http://www.windfall.com,Windfall,,
Stocktwits,Stocktwits is a real-time financial communications platform for the financial and investing community.,active,United States,New York,New York,51-100,http://stocktwits.com,Stocktwits,,
Onyx Renewable Partners,"Onyx is a national provider of clean energy and decarbonization solutions to businesses, real estate, schools and government agencies.",active,United States,New York,New York,51-100,https://www.onyxrenewables.com/,Onyx Renewable Partners,,
Lumin Digital,"Lumin Digital provides cloud-native digital banking solutions, helping financial institutions enhance user experience and engagement.",active,United States,California,San Ramon,251-500,https://lumindigital.com,Lumin Digital,,
Injective,"Injective is the blockchain built for finance. It is an open, interoperable network for applications shaping the future of DeFi.",active,United States,New York,New York,51-100,https://injective.com,Injective,,
Nav,"Nav bridges the gap between SMB and financial institutions by bringing transparency, certainty, and efficiency to B2B credit and financing.",active,United States,Utah,Draper,101-250,https://www.nav.com/,Nav,,
Capitolis,Capitolis provides technology solutions for optimizing capital markets and investments.,active,United States,New York,New York,101-250,https://www.capitolis.com,Capitolis,,
Phantom,"Phantom is a crypto wallet that facilitates the buying, trading, and storing of cryptocurrencies, including NFTs and tokens.",active,United States,California,San Francisco,101-250,https://phantom.com,Phantom,,
Lendistry,"Lendistry is a fintech company that offers business loans, SBA loans, and commercial real estate loans for small business owners.",active,United States,California,Brea,251-500,http://www.Lendistry.com,Lendistry,,
Climb Credit,Innovative student payment platform that makes career-focused education more accessible and affordable than ever before.,active,United States,Nevada,Las Vegas,51-100,https://climbcredit.com,Climb Credit,,
Endeavor,"Endeavor supports high-impact entrepreneurs around the world. Endeavor Catalyst is the rules-based, co-investment fund of Endeavor.",active,United States,New York,New York,251-500,http://www.endeavor.org,Endeavor,,
Pump,Forbes calls us the 'costco' of cloud,active,United States,California,San Francisco,51-100,https://www.pump.co,Pump,,
Routable,Routable is a B2B payments-based platform that allows its users to send and receive business-to-business payments.,active,United States,California,San Francisco,51-100,https://routable.com/,Routable,,
MaintainX,MaintainX is a provider of a work order and procedure digitization platform for industrial and frontline teams.,active,United States,California,San Francisco,251-500,https://www.getmaintainx.com,MaintainX,,
Saphyre,"Saphyre is a pre-trade onboarding platform for exchange data and documents between asset managers, brokers and 3rd party administrators.",active,United States,New Jersey,Hoboken,51-100,https://www.saphyre.com/,Saphyre,,
Trullion,Trullion is an AI-powered accounting platform that automates financial workflows for accounting and audit teams.,active,United States,New York,New York,51-100,https://www.trullion.com,Trullion,,
Treasury Prime,Treasury Prime is a Banking-as-a-Service company that connects banks and FinTechs through an API.,active,United States,California,San Francisco,51-100,https://treasuryprime.com,Treasury Prime,,
Portfolia,"Portfolia is an investment funds designed for women, backing innovative companies for returns and impact",active,United States,California,Palo Alto,101-250,https://www.portfolia.co,Portfolia,,
Uplift,"Uplift is an enterprise buy now, pay later solution offering a complete range of personalized payment options.",active,United States,California,Menlo Park,101-250,http://www.uplift.com,Uplift,,
Arta Finance,Arta Finance is on a mission to help people enjoy more successful financial lives.,active,United States,California,Mountain View,101-250,https://www.artafinance.com,Arta Finance,,
Cube,Cube is a spreadsheet-native platform that focuses on meeting strategic finance teams for everyday workflows.,active,United States,New York,New York,101-250,https://www.cubesoftware.com,Cube,,
Public,"Public is the investing platform for those who take it seriously—offering stocks, ETFs, options, crypto, bonds & retirement accounts",active,United States,New York,New York,101-250,https://public.com,Public,,
National Equity Fund,National Equity Fund creates affordable housing options for low-income families and individuals.,active,United States,Illinois,Chicago,101-250,https://www.nationalequityfund.org/,National Equity Fund,,
Klarity,"Klarity is an online documentation platform that provides manual document processing, reviewing, and management services.",active,United States,California,San Francisco,101-250,https://www.klarity.ai/,Klarity,,
Papaya,Papaya is a developer of an online mobile application and payments technology designed to simplify bill payment for consumers.,active,United States,California,Los Angeles,51-100,https://PapayaPay.com,Papaya,,
Mesh Payments,Mesh provides a centralized and automated spend platform that helps finance teams with visibility and control.,active,United States,New York,New York,101-250,https://meshpayments.com,Mesh Payments,,
Fraud.net,"Fraud.net operates an AI-native fraud, AML, and risk management platform designed specifically for digital enterprises and fintechs globally",active,United States,New York,New York,51-100,https://fraud.net,Fraud.net,,
Rho,"Rho is the all-in-one financial platform organizations rely on to manage spend and cash with greater efficiency, control, and visibility.",active,United States,New York,New York,251-500,https://rho.co,Rho,,
Zeni,Zeni is an AI bookkeeping software backed by a dedicated finance team.,active,United States,California,Palo Alto,251-500,https://www.zeni.ai/,Zeni,,
VGS,VGS is the World'd Leader in Payment Tokenization,active,United States,California,San Francisco,251-500,https://www.verygoodsecurity.com,VGS,,
EvolutionIQ,EvolutionIQ is an AI company that offers claims guidance solutions for insurance companies.,active,United States,New York,New York,101-250,http://www.evolutioniq.com,EvolutionIQ,,
Tabs,Tabs is the first AI Driven Revenue Automation Platform for B2B Finance,active,United States,New York,New York,51-100,https://tabs.inc/,Tabs,,
Nala,Nala is a FinTech company developing a mobile payments application to simplify money transfers and transactions.,active,United States,New Jersey,Hoboken,51-100,https://www.nala.com/,Nala,,
Digits,Digits is a fintech company that offers financial tools for small businesses.,active,United States,California,San Francisco,51-100,https://www.digits.com,Digits,,
Kintsugi AI,"Kintsugi is an AI-based tax assistant platform that provides nexus tracking, reporting, filing, and integration services.",active,United States,California,San Francisco,101-250,https://trykintsugi.com,Kintsugi AI,,
Nasdaq Private Market,"NPM brings together global private companies, banks and brokers, stakeholders, and investors together to transact in one marketplace.",active,United States,California,San Francisco,51-100,http://www.nasdaqprivatemarket.com,Nasdaq Private Market,,
Nova Credit,Nova Credit is a credit infrastructure and analytics company that enables businesses to grow responsibly through alternative credit data.,active,United States,California,San Francisco,51-100,http://novacredit.com,Nova Credit,,
Ripio,Ripio is a bitcoin and digital payments company that provides electronic payment solutions for businesses in Latin America.,active,United States,California,San Francisco,251-500,https://www.ripio.com/,Ripio,,
Grey,"Secure global banking in 40+ markets. US, UK & EU bank accounts. Global payments from 80+ countries. Regulated by FINTRAC & FinCEN.",active,United States,Delaware,Middletown,51-100,https://grey.co,Grey,,
Anchorage Digital,Anchorage Digital is a regulated crypto platform that provides institutions with integrated financial services and infrastructure solutions.,active,United States,California,San Francisco,251-500,https://www.anchorage.com,Anchorage Digital,,
RoadFlex,Smart fuel card and expense management platform for commercial fleets of all sizes,active,United States,California,San Francisco,51-100,https://www.roadflex.com,RoadFlex,,
SoLo Funds,SoLo is a community finance platform where our members step up for one another.,active,United States,California,Los Angeles,51-100,http://www.solofunds.com,SoLo Funds,,
Binance.US,Binance is a cryptocurrency exchange that provides a platform for trading various cryptocurrencies.,active,United States,California,Palo Alto,251-500,https://www.binance.us,Binance.US,,
Array,"Array delivers embeddable, custom-branded credit and identity tools, personalized offers, and more.",active,United States,New York,New York,251-500,https://www.array.com,Array,,
Noyo,Noyo is a software company that provides digital infrastructure to bring health insurance with an API platform.,active,United States,California,San Francisco,51-100,http://www.noyo.com,Noyo,,
Prometheum,"Prometheum is a SEC and FINRA-regulated, full-service market ecosystem for blockchain securities.",active,United States,New York,New York,51-100,https://www.prometheum.com/,Prometheum,,
Stash,"Stash develops a personal finance application to combine banking, investing, and advice into one platform.",active,United States,New York,New York,251-500,http://www.stash.com,Stash,,
Unqork,"Unqork is a no-code enterprise application platform that helps companies build, deploy, and manage complex applications.",active,United States,New York,New York,251-500,https://www.unqork.com,Unqork,,
Parafin,Parafin is a financial infrastructure company that offers pre-built financial services programs to support small businesses.,active,United States,California,San Francisco,51-100,https://www.parafin.com,Parafin,,
Ava Labs,"AVA is a blockchain platform with revolutionary scalability, decentralization, security, and flexibility.",active,United States,New York,New York,101-250,https://avalabs.org,Ava Labs,,
TJC,TJC is a private equity firm that specializes in buying and building companies.,active,United States,New York,New York,51-100,https://tjclp.com,TJC,,
Model ML,Model ML is an artificial intelligence platform that enhances workflows for investment banks and private equity firms.,active,United States,New York,New York,51-100,https://www.modelml.com,Model ML,,
Benepass,Benepass is a benefits administration platform that helps companies manage and distribute employee perks and benefits.,active,United States,New York,New York,51-100,http://www.getbenepass.com,Benepass,,
Paxos,Paxos is a regulated financial institution building infrastructure to enable movement between physical and digital assets.,active,United States,New York,New York,251-500,https://www.paxos.com,Paxos,,
Orange Bank & Trust Company,Orange Bank & Trust Company is a commercial bank.,active,United States,New York,Middletown,101-250,http://orangecountytrust.com,Orange Bank & Trust Company,,
Hummingbird,Hummingbird is a technology company that provides solutions to enhance anti-money laundering and counter-terrorist financing investigations.,active,United States,California,Covina,51-100,https://hummingbird.co/,Hummingbird,,
Quanta,Quanta provides software companies with real-time financial clarity and empowerment.,active,United States,California,San Francisco,51-100,https://www.usequanta.com/,Quanta,,